{
  "schema": 1,
  "category": "cryptotokens",
  "description": "Crypto token names and symbols. Opt in explicitly.",
  "values": [
    "AAVE",
    "ADA",
    "ALGO",
    "APT",
    "ARB",
    "ATOM",
    "AVAX",
    "BAL",
    "BCH",
    "BNB",
    "BONK",
    "BTC",
    "CAKE",
    "cbETH",
    "COMP",
    "CRV",
    "crvUSD",
    "CVX",
    "DAI",
    "DOGE",
    "DOT",
    "ENA",
    "ETH",
    "ETHFI",
    "EURC",
    "ezETH",
    "FDUSD",
    "FIL",
    "FLOKI",
    "FRAX",
    "GHO",
    "HBAR",
    "ICP",
    "INJ",
    "JTO",
    "JUP",
    "KSM",
    "LDO",
    "LTC",
    "LUSD",
    "MATIC",
    "MKR",
    "NEAR",
    "OP",
    "PAXG",
    "PEPE",
    "POL",
    "PYTH",
    "PYUSD",
    "RAY",
    "RENDER",
    "rETH",
    "RNDR",
    "rsETH",
    "SEI",
    "SHIB",
    "SKY",
    "SNX",
    "SOL",
    "stETH",
    "STRK",
    "SUI",
    "sUSDe",
    "SUSHI",
    "TIA",
    "TON",
    "TRX",
    "TUSD",
    "UNI",
    "USDC",
    "USDD",
    "USDe",
    "USDP",
    "USDS",
    "USDT",
    "VET",
    "WBTC",
    "weETH",
    "WETH",
    "WIF",
    "Wrapped Bitcoin",
    "wstETH",
    "XAUT",
    "XLM",
    "XMR",
    "XRP",
    "ZK"
  ]
}
