{
  "schema": 1,
  "category": "publicfigures",
  "description": "Contemporary political and public figures from multiple regions.",
  "values": [
    "Abdel Fattah el-Sisi",
    "Abdullah II of Jordan",
    "Abiy Ahmed",
    "Alberto Núñez Feijóo",
    "Alexander De Croo",
    "Alexander Stubb",
    "Alexandria Ocasio-Cortez",
    "Alice Weidel",
    "Anders Fogh Rasmussen",
    "Andrés Manuel López Obrador",
    "Andrzej Duda",
    "Angela Merkel",
    "Annalena Baerbock",
    "Anthony Albanese",
    "António Costa",
    "Arvind Kejriwal",
    "Ashraf Ghani",
    "Barack Obama",
    "Bashar al-Assad",
    "Benjamin Netanyahu",
    "Benny Gantz",
    "Bernie Sanders",
    "Bill Clinton",
    "Binali Yildirim",
    "Bob Dole",
    "Bola Tinubu",
    "Bongbong Marcos",
    "Boris Johnson",
    "Carles Puigdemont",
    "Charles Michel",
    "Chris Hipkins",
    "Christine Lagarde",
    "Christopher Luxon",
    "Chuck Schumer",
    "Claudia Sheinbaum",
    "Colin Powell",
    "Cory Booker",
    "Cyril Ramaphosa",
    "Dalia Grybauskaite",
    "Dan Crenshaw",
    "Daniel Ortega",
    "David Cameron",
    "David Lammy",
    "Denis Sassou Nguesso",
    "Dick Schoof",
    "Dmitry Medvedev",
    "Donald Trump",
    "Droupadi Murmu",
    "Edi Rama",
    "Eduard Heger",
    "Elisabeth Borne",
    "Emmanuel Macron",
    "Enrico Letta",
    "Evo Morales",
    "Ferdinand Marcos Jr",
    "François Hollande",
    "Frank-Walter Steinmeier",
    "Frans Timmermans",
    "Friedrich Merz",
    "Fumio Kishida",
    "Gabriel Boric",
    "Gavin Newsom",
    "Geert Wilders",
    "George H W Bush",
    "George W Bush",
    "Giorgia Meloni",
    "Gitanas Nauseda",
    "Gordon Brown",
    "Graca Machel",
    "Gustavo Petro",
    "Hakeem Jeffries",
    "Hassan Rouhani",
    "Hibatullah Akhundzada",
    "Hillary Clinton",
    "Horst Seehofer",
    "Ilhan Omar",
    "Imran Khan",
    "Ivanka Trump",
    "J D Vance",
    "Jacinda Ardern",
    "Jair Bolsonaro",
    "James Cleverly",
    "Javier Milei",
    "Jean-Claude Juncker",
    "Jean-Luc Mélenchon",
    "Jens Stoltenberg",
    "Jeremy Corbyn",
    "Joe Biden",
    "John Bolton",
    "John Fetterman",
    "John Kerry",
    "John McCain",
    "John Thune",
    "José Manuel Barroso",
    "José Mourinho",
    "Juan Guaido",
    "Julius Malema",
    "Justin Trudeau",
    "Kaja Kallas",
    "Kamala Harris",
    "Karin Keller-Sutter",
    "Kassym-Jomart Tokayev",
    "Keir Starmer",
    "Khalifa Haftar",
    "Kim Jong Un",
    "King Charles III",
    "King Felipe VI",
    "King Willem-Alexander",
    "Kirsten Gillibrand",
    "Kristalina Georgieva",
    "Lai Ching-te",
    "Leni Robredo",
    "Li Qiang",
    "Liz Truss",
    "Lloyd Austin",
    "Luiz Inácio Lula da Silva",
    "Lula da Silva",
    "Mahathir Mohamad",
    "Mahmoud Abbas",
    "Manmohan Singh",
    "Maria Zakharova",
    "Mariano Rajoy",
    "Marine Le Pen",
    "Mario Draghi",
    "Mark Carney",
    "Mark Rutte",
    "Matteo Salvini",
    "Mette Frederiksen",
    "Michael Bloomberg",
    "Michael Gove",
    "Mike Johnson",
    "Mike Pence",
    "Mike Pompeo",
    "Milorad Dodik",
    "Mitch McConnell",
    "Mohamed bin Zayed Al Nahyan",
    "Mohammed bin Salman",
    "Muhammad Yunus",
    "Nancy Pelosi",
    "Narendra Modi",
    "Nayib Bukele",
    "Nicolas Sarkozy",
    "Nigel Farage",
    "Nikki Haley",
    "Nirmala Sitharaman",
    "Olaf Scholz",
    "Pablo Iglesias",
    "Paul Kagame",
    "Paul Ryan",
    "Pedro Sánchez",
    "Petr Fiala",
    "Pierre Poilievre",
    "Pope Francis",
    "Pope Leo XIV",
    "Prabowo Subianto",
    "Rafael Correa",
    "Rahul Gandhi",
    "Recep Tayyip Erdogan",
    "Recep Tayyip Erdoğan",
    "Rishi Sunak",
    "Robert Fico",
    "Roberta Metsola",
    "Rodrigo Duterte",
    "Ron DeSantis",
    "Ruben Gallego",
    "Sadiq Khan",
    "Sanna Marin",
    "Sebastian Kurz",
    "Sergey Lavrov",
    "Sergio Mattarella",
    "Sheikh Hasina",
    "Shigeru Ishiba",
    "Shinzo Abe",
    "Srettha Thavisin",
    "Suella Braverman",
    "Susan Collins",
    "Tajani Antonio",
    "Tarique Rahman",
    "Ted Cruz",
    "Thaksin Shinawatra",
    "Theresa May",
    "Tim Walz",
    "Tobias Billstrom",
    "Tom Cotton",
    "Tony Blair",
    "Tsai Ing-wen",
    "Tucker Carlson",
    "Tulsi Gabbard",
    "Ursula von der Leyen",
    "Viktor Orban",
    "Vivek Ramaswamy",
    "Vladimir Putin",
    "Volodymyr Zelenskyy",
    "Wang Yi",
    "William Ruto",
    "Winston Peters",
    "Xi Jinping",
    "Yair Lapid",
    "Yoon Suk Yeol",
    "Yoshihide Suga",
    "Yulia Tymoshenko",
    "Zoran Milanovic"
  ]
}
