{
  "schema": 1,
  "category": "crypto",
  "description": "Cryptocurrency, blockchain network, token, wallet, exchange, and Web3 project identities.",
  "values": [
    "0x protocol",
    "1inch",
    "aave",
    "ankr",
    "aptos",
    "arbitrum",
    "arweave",
    "avalanche",
    "axie infinity",
    "babylon",
    "balancer",
    "base chain",
    "beam",
    "binance exchange",
    "bitfinex",
    "bitstamp",
    "bittensor",
    "blur",
    "blur marketplace",
    "bonk",
    "bybit",
    "celestia",
    "chiliz",
    "coinbase exchange",
    "coingecko",
    "compound",
    "cosmos hub",
    "crypto com",
    "curve dao",
    "dai",
    "dydx",
    "eigenlayer",
    "ethereum classic",
    "fetch ai",
    "filecoin",
    "flare",
    "flow blockchain",
    "frax",
    "gala games",
    "gate io",
    "gemini exchange",
    "gnosis",
    "harmony one",
    "immutable x",
    "injective",
    "jupiter exchange",
    "kaspa",
    "kava",
    "kraken exchange",
    "kucoin token",
    "ledger live",
    "lido dao",
    "loopring",
    "magic eden",
    "makerdao",
    "mantle",
    "metamask",
    "mina protocol",
    "multiversx",
    "near protocol",
    "neo",
    "oasis network",
    "osmosis",
    "pancakeswap",
    "pax dollar",
    "pepe coin",
    "phantom wallet",
    "quant network",
    "ravencoin",
    "render network",
    "rocket pool",
    "safe token",
    "sei network",
    "shiba inu",
    "stacks",
    "sushiswap",
    "synthetix",
    "terra classic",
    "tezos",
    "the graph",
    "the sandbox",
    "theta network",
    "thorchain",
    "toncoin",
    "trezor suite",
    "tron",
    "uniswap",
    "usd coin",
    "vechain",
    "worldcoin",
    "wrapped bitcoin",
    "xrpl",
    "zilliqa"
  ]
}
