{
  "schema": 1,
  "category": "internationalorganizations",
  "description": "International and intergovernmental organizations.",
  "values": [
    "African Development Bank",
    "African Export-Import Bank",
    "African Union",
    "African Union Commission",
    "Arab League",
    "Asia-Pacific Economic Cooperation",
    "Asian Development Bank",
    "Asian Infrastructure Investment Bank",
    "Association of Southeast Asian Nations",
    "Bank for International Settlements",
    "BRICS",
    "Caribbean Community",
    "Central American Integration System",
    "Common Market for Eastern and Southern Africa",
    "Commonwealth of Nations",
    "Council of Europe",
    "Council of the European Union",
    "East African Community",
    "Economic Community of West African States",
    "Eurasian Economic Union",
    "Eurojust",
    "European Bank for Reconstruction and Development",
    "European Banking Authority",
    "European Central Bank",
    "European Commission",
    "European Council",
    "European Court of Auditors",
    "European Environment Agency",
    "European Food Safety Authority",
    "European Free Trade Association",
    "European Insurance and Occupational Pensions Authority",
    "European Investment Bank",
    "European Medicines Agency",
    "European Parliament",
    "European Securities and Markets Authority",
    "European Space Agency",
    "European Union",
    "European Union Agency for Cybersecurity",
    "European Union Aviation Safety Agency",
    "European Union Intellectual Property Office",
    "Europol",
    "FIFA",
    "Financial Action Task Force",
    "Food and Agriculture Organization",
    "Frontex",
    "G20",
    "International Association of Insurance Supervisors",
    "International Atomic Energy Agency",
    "International Bank for Reconstruction and Development",
    "International Centre for Settlement of Investment Disputes",
    "International Chamber of Commerce",
    "International Civil Aviation Organization",
    "International Committee of the Red Cross",
    "International Court of Justice",
    "International Criminal Court",
    "International Criminal Police Organization",
    "International Crisis Group",
    "International Development Association",
    "International Electrotechnical Commission",
    "International Energy Agency",
    "International Federation of Accountants",
    "International Federation of Red Cross and Red Crescent Societies",
    "International Finance Corporation",
    "International Fund for Agricultural Development",
    "International Institute for Democracy and Electoral Assistance",
    "International Labour Organization",
    "International Maritime Organization",
    "International Maritime Pilots Association",
    "International Monetary Fund",
    "International Olympic Committee",
    "International Organization for Migration",
    "International Organization for Standardization",
    "International Organization of Securities Commissions",
    "International Red Cross and Red Crescent Movement",
    "International Renewable Energy Agency",
    "International Rescue Committee",
    "International Road Transport Union",
    "International Seabed Authority",
    "International Telecommunication Union",
    "International Tribunal for the Law of the Sea",
    "International Union for Conservation of Nature",
    "International Union of Pure and Applied Chemistry",
    "International Union of Railways",
    "Interpol",
    "Mercosur",
    "Multilateral Investment Guarantee Agency",
    "NATO",
    "OPEC Fund for International Development",
    "Organisation for Economic Co-operation and Development",
    "Organisation internationale de la Francophonie",
    "Organisation of Eastern Caribbean States",
    "Organization for Security and Co-operation in Europe",
    "Organization of American States",
    "Organization of Islamic Cooperation",
    "Organization of Petroleum Exporting Countries",
    "Organization of the Black Sea Economic Cooperation",
    "Organization of Turkic States",
    "Pacific Community",
    "Pacific Islands Development Forum",
    "Pacific Islands Forum",
    "Pan American Health Organization",
    "Permanent Court of Arbitration",
    "Shanghai Cooperation Organisation",
    "South Asian Association for Regional Cooperation",
    "Southern African Development Community",
    "UN Office for the Coordination of Humanitarian Affairs",
    "UN Women",
    "UNESCO",
    "UNHCR",
    "UNICEF",
    "United Nations",
    "United Nations Conference on Trade and Development",
    "United Nations Development Programme",
    "United Nations Environment Programme",
    "United Nations Human Settlements Programme",
    "United Nations Industrial Development Organization",
    "United Nations Office for Project Services",
    "United Nations Office on Drugs and Crime",
    "United Nations Population Fund",
    "Universal Postal Union",
    "World Anti-Doping Agency",
    "World Bank",
    "World Customs Organization",
    "World Food Programme",
    "World Health Assembly",
    "World Health Organization",
    "World Intellectual Property Organization",
    "World Meteorological Organization",
    "World Organisation for Animal Health",
    "World Tourism Organization",
    "World Trade Organization",
    "World Trade Organization Secretariat",
    "World Wide Fund for Nature"
  ]
}
