{
  "schema": 1,
  "category": "multilingual",
  "description": "Additional official-role, support, administrative, and trusted-identity phrases across supported languages.",
  "values": [
    "account ufficiale",
    "administrador",
    "administrador oficial",
    "administradora",
    "administrateur",
    "administrator hu",
    "administrator konto",
    "administrator pl",
    "administrator ro",
    "administrator sv",
    "administratrice",
    "akun resmi",
    "amministratore",
    "amministratrice",
    "asistenta oficiala",
    "assistance officielle",
    "atendimento oficial",
    "beheerder",
    "compte officiel",
    "cont oficial",
    "conta oficial",
    "cuenta oficial",
    "dich vu khach hang chinh thuc",
    "dukungan resmi",
    "gestionnaire",
    "gestor",
    "gestore",
    "hivatalos fiok",
    "hivatalos tamogatas",
    "hivatalos ugyfelszolgalat",
    "ho tro chinh thuc",
    "kiem duyet vien",
    "layanan pelanggan resmi",
    "moderador",
    "moderador oficial",
    "moderadora",
    "moderateur",
    "moderator",
    "moderator cs",
    "moderator hu",
    "moderator id",
    "moderator konto",
    "moderator pl",
    "moderator ro",
    "moderator sv",
    "moderator tr",
    "moderatore",
    "moderatrice",
    "officieel account",
    "officiele klantenservice",
    "officiele ondersteuning",
    "officiell kundtjanst",
    "officiell support",
    "officiellt konto",
    "offizieller kundendienst",
    "offizieller support",
    "offizielles konto",
    "oficialni podpora",
    "oficialni ucet",
    "oficialni zakaznicka podpora",
    "oficjalna obsluga klienta",
    "oficjalne konto",
    "oficjalne wsparcie",
    "pengelola",
    "quan tri vien",
    "resmi destek",
    "resmi hesap",
    "resmi musteri hizmetleri",
    "service client officiel",
    "servicio al cliente oficial",
    "serviciu clienti oficial",
    "servizio clienti ufficiale",
    "soporte oficial",
    "spravce",
    "super kullanici",
    "superbenutzer",
    "supergebruiker",
    "superuser id",
    "superusuario",
    "superusuario oficial",
    "superutente",
    "superutilisateur",
    "superuzytkownik",
    "suporte oficial",
    "supporto ufficiale",
    "systeembeheerder",
    "systemverwalter",
    "tai khoan chinh thuc",
    "verwalter",
    "yonetici"
  ]
}
