{
  "schema": 1,
  "category": "media",
  "description": "News, publishing, broadcasting and media organizations.",
  "values": [
    "ABC Australia",
    "ABC News",
    "Accel Entertainment",
    "Accel Entertainment, Inc.",
    "Aftonbladet",
    "Agassi Sports Entertainment",
    "Agassi Sports Entertainment Corp.",
    "Agence France-Presse",
    "Al Arabiya",
    "Al Jazeera",
    "Al-Ahram",
    "Algemeen Dagblad",
    "ALLIANCE ENTERTAINMENT",
    "ALLIANCE ENTERTAINMENT HOLDING CORP",
    "Allied Gaming & Entertainment",
    "Allied Gaming & Entertainment Inc.",
    "AMC ENTERTAINMENT",
    "AMC ENTERTAINMENT HOLDINGS, INC.",
    "Anadolu Agency",
    "ANSA",
    "AP News",
    "ARD",
    "Arirang News",
    "Ars Technica",
    "Asahi Shimbun",
    "Associated Press",
    "Axios",
    "Baosheng Media",
    "Baosheng Media Group Holdings Ltd",
    "Barron's",
    "BBC",
    "BBC News",
    "BEASLEY BROADCAST",
    "BEASLEY BROADCAST GROUP INC",
    "Belfast Telegraph",
    "Berliner Zeitung",
    "BetaNews",
    "BFM TV",
    "Bild",
    "Blick",
    "Bloomberg",
    "Blue Hat Interactive Entertainment Technology",
    "BNR Nieuwsradio",
    "Boston Globe",
    "Bright Mountain Media",
    "Bright Mountain Media, Inc.",
    "Business Insider",
    "BuzzFeed News",
    "Caesars Entertainment",
    "Caesars Entertainment, Inc.",
    "CareView Communications",
    "CareView Communications Inc",
    "CBC",
    "CBS News",
    "Channel 4 News",
    "Channel NewsAsia",
    "CHARTER COMMUNICATIONS, INC. /MO/",
    "China Daily",
    "Clarín",
    "CNA",
    "CNBC",
    "CNET",
    "CNN",
    "COGENT COMMUNICATIONS",
    "COGENT COMMUNICATIONS HOLDINGS, INC.",
    "CONSERVATIVE BROADCAST MEDIA & PUBLISHING",
    "CONSERVATIVE BROADCAST MEDIA & PUBLISHING, INC.",
    "Corriere della Sera",
    "Creative Media & Community Trust",
    "Creative Media & Community Trust Corp",
    "CTV News",
    "CUMULUS MEDIA",
    "CUMULUS MEDIA INC",
    "Daily Beast",
    "Daily Express",
    "Daily Mail",
    "Daily Mirror",
    "Daily Sabah",
    "Dave & Buster's Entertainment",
    "Dave & Buster's Entertainment, Inc.",
    "Dawn",
    "De Telegraaf",
    "de Volkskrant",
    "Deadline Hollywood",
    "Der Spiegel",
    "Der Tagesspiegel",
    "DESTINY MEDIA TECHNOLOGIES",
    "DESTINY MEDIA TECHNOLOGIES INC",
    "Detroit Free Press",
    "Deutsche Welle",
    "Die Presse",
    "Die Zeit",
    "Digital Brand Media & Marketing",
    "Digital Brand Media & Marketing Group, Inc.",
    "Dolphin Entertainment",
    "Dolphin Entertainment, Inc.",
    "El Comercio",
    "El Mundo",
    "El Observador",
    "El País",
    "El Tiempo",
    "Eline Entertainment",
    "Eline Entertainment Group, Inc.",
    "EMERSON RADIO",
    "EMERSON RADIO CORP",
    "Engadget",
    "ENTRAVISION COMMUNICATIONS",
    "ENTRAVISION COMMUNICATIONS CORP",
    "ESPORTS ENTERTAINMENT",
    "ESPORTS ENTERTAINMENT GROUP, INC.",
    "Estadão",
    "Euronews",
    "Evening Standard",
    "Fakt",
    "Fast Company",
    "Financial Times",
    "Flutter Entertainment",
    "Flutter Entertainment plc",
    "Folha de S.Paulo",
    "Forbes",
    "Fortune",
    "Fox News",
    "France 24",
    "France Télévisions",
    "Frankfurter Allgemeine Zeitung",
    "Frontier Communications Parent",
    "Frontier Communications Parent, Inc.",
    "FULLNET COMMUNICATIONS",
    "FULLNET COMMUNICATIONS INC",
    "Gamelancer Media",
    "Gamelancer Media Corp.",
    "GameSpot",
    "Gazeta Wyborcza",
    "Gizmodo",
    "Global News Canada",
    "Globe and Mail",
    "GOLD ENTERTAINMENT",
    "GOLD ENTERTAINMENT GROUP INC",
    "GOLDEN ENTERTAINMENT",
    "GOLDEN ENTERTAINMENT, INC.",
    "Goliath Film & Media",
    "Goliath Film & Media Holdings",
    "GQ",
    "GRAY MEDIA",
    "GRAY MEDIA, INC",
    "HackerNoon",
    "Hall of Fame Resort & Entertainment",
    "Hall of Fame Resort & Entertainment Co",
    "Handelsblatt",
    "Het Parool",
    "Hindustan Times",
    "HuffPost",
    "IDW MEDIA",
    "IDW MEDIA HOLDINGS, INC.",
    "IGN",
    "Independent",
    "India Today",
    "Indian Express",
    "Inspired Entertainment",
    "Inspired Entertainment, Inc.",
    "Integrated Media Technology",
    "Integrated Media Technology Ltd",
    "INTERMEDIA CLOUD COMMUNICATIONS",
    "INTERMEDIA CLOUD COMMUNICATIONS, INC.",
    "International Business Times",
    "International Media Acquisition",
    "International Media Acquisition Corp.",
    "Iridium Communications",
    "Iridium Communications Inc.",
    "ITV News",
    "Jerusalem Post",
    "K Wave Media",
    "K Wave Media Ltd.",
    "Kartoon Studios",
    "Kartoon Studios, Inc.",
    "KBS",
    "Kyodo News",
    "La Nación",
    "La Repubblica",
    "La Stampa",
    "La Vanguardia",
    "Le Figaro",
    "Le Monde",
    "Le Parisien",
    "Les Echos",
    "Libération",
    "Liberty Media",
    "Liberty Media Corp",
    "Lionsgate Studios",
    "Lionsgate Studios Corp.",
    "Live Nation Entertainment",
    "Live Nation Entertainment, Inc.",
    "Loop Media",
    "Loop Media, Inc.",
    "Los Angeles Times",
    "Lucky Strike Entertainment",
    "Lucky Strike Entertainment Corp",
    "MacRumors",
    "Madison Square Garden Entertainment",
    "Madison Square Garden Entertainment Corp.",
    "Mashable",
    "MBC Korea",
    "Meduza",
    "Melco Resorts & Entertainment",
    "Melco Resorts & Entertainment LTD",
    "Metro UK",
    "MSNBC",
    "National Geographic",
    "National Post",
    "NBC News",
    "NDTV",
    "NEWS",
    "NEWS CORP",
    "Newsweek",
    "NEXSTAR MEDIA",
    "NEXSTAR MEDIA GROUP, INC.",
    "Next Fifteen Communications Group plc/ADR",
    "NHK",
    "Nikkei",
    "Nikkei Asia",
    "Nine News",
    "NOS",
    "NPR",
    "NRC",
    "NRC Handelsblad",
    "NTV",
    "NU.nl",
    "Nuvera Communications",
    "Nuvera Communications, Inc.",
    "O Globo",
    "OUTFRONT Media",
    "OUTFRONT Media Inc.",
    "Paranovus Entertainment Technology",
    "Paranovus Entertainment Technology Ltd.",
    "PARTNER COMMUNICATIONS",
    "PARTNER COMMUNICATIONS CO LTD",
    "PBS",
    "PC Gamer",
    "PENN Entertainment",
    "PENN Entertainment, Inc.",
    "Phoenix New Media",
    "Phoenix New Media Ltd",
    "Politico",
    "Polygon",
    "Quartz",
    "QUEBECOR MEDIA",
    "QUEBECOR MEDIA INC",
    "QYOU Media",
    "QYOU Media Inc.",
    "Radio France",
    "Radio France Internationale",
    "Radio Free Europe",
    "RAI",
    "Rappler",
    "Reservoir Media",
    "Reservoir Media, Inc.",
    "Reuters",
    "Ribbon Communications",
    "Ribbon Communications Inc.",
    "ROGERS COMMUNICATIONS",
    "ROGERS COMMUNICATIONS INC",
    "Rolling Stone",
    "RTÉ News",
    "RTL Nieuws",
    "RTVE",
    "SADDLE RANCH MEDIA",
    "SADDLE RANCH MEDIA, INC.",
    "SAGA COMMUNICATIONS",
    "SAGA COMMUNICATIONS INC",
    "SALEM MEDIA GROUP, INC. /DE/",
    "SBA COMMUNICATIONS",
    "SBA COMMUNICATIONS CORP",
    "SBS Australia",
    "SBS Korea",
    "Science Magazine",
    "Seaport Entertainment",
    "Seaport Entertainment Group Inc.",
    "SEQUANS COMMUNICATIONS",
    "Seven News",
    "Six Flags Entertainment Corporation/NEW",
    "Sky News",
    "SMC Entertainment",
    "SMC Entertainment, Inc.",
    "South China Morning Post",
    "Sphere Entertainment",
    "Sphere Entertainment Co.",
    "Sports Illustrated",
    "STARZ ENTERTAINMENT CORP /CN/",
    "STUDIO CITY INTERNATIONAL",
    "STUDIO CITY INTERNATIONAL HOLDINGS Ltd",
    "Süddeutsche Zeitung",
    "Sunrise Communications",
    "Sunrise Communications AG",
    "Sydney Morning Herald",
    "TechCrunch",
    "TechRadar",
    "Tencent Music Entertainment",
    "Tencent Music Entertainment Group",
    "The Atlantic",
    "The Conversation",
    "The Daily Telegraph",
    "The Economist",
    "The Globe and Mail",
    "The Guardian",
    "The Hill",
    "The Hindu",
    "The Independent",
    "The Intercept",
    "The Japan Times",
    "The New York Times",
    "The New Yorker",
    "The Telegraph",
    "The Times",
    "The Times of India",
    "The Verge",
    "The Wall Street Journal",
    "The Washington Post",
    "Thoughtful Media",
    "Thoughtful Media Group Inc.",
    "THUMZUP MEDIA",
    "THUMZUP MEDIA Corp",
    "Time",
    "Time Magazine",
    "Times of India",
    "Toronto Star",
    "Townsquare Media",
    "Townsquare Media, Inc.",
    "Trouw",
    "Trump Media & Technology",
    "Trump Media & Technology Group Corp.",
    "USA Today",
    "Vanity Fair",
    "Variety",
    "VERIZON COMMUNICATIONS",
    "VERIZON COMMUNICATIONS INC",
    "Vox",
    "VS MEDIA",
    "VS MEDIA Holdings Ltd",
    "Weave Communications",
    "Weave Communications, Inc.",
    "WEBTOON Entertainment",
    "WEBTOON Entertainment Inc.",
    "Wired",
    "Xtreme One Entertainment",
    "Xtreme One Entertainment, Inc.",
    "Yahoo News",
    "Yomiuri Shimbun",
    "Yonhap News Agency",
    "ZDF",
    "ZDNET",
    "Zoom Communications",
    "Zoom Communications, Inc."
  ]
}
