{
  "schema": 1,
  "category": "fiction",
  "description": "Fictional characters and franchises.",
  "values": [
    "Agent 47",
    "Ahsoka Tano",
    "Akira Fudo",
    "Aladdin",
    "Albus Dumbledore",
    "Alice in Wonderland",
    "Alucard",
    "Amy Rose",
    "Anakin Skywalker",
    "Android 18",
    "Anna",
    "Aqua",
    "Aquaman",
    "Aragorn",
    "Ariel",
    "Arthur Dent",
    "Arthur Morgan",
    "Arya Stark",
    "Ash Ketchum",
    "Aslan",
    "Astarion",
    "Asterix",
    "Astro Boy",
    "Atreus",
    "Azula",
    "Bane",
    "Barbie",
    "Bart Simpson",
    "Batman",
    "Baymax",
    "Beetlejuice",
    "Bender Bending Rodriguez",
    "Big Boss",
    "Bilbo Baggins",
    "Black Panther",
    "Black Widow",
    "Blastoise",
    "Blossom",
    "Boba Fett",
    "Bojack Horseman",
    "Boromir",
    "Bowser",
    "Bruce Banner",
    "Bruce Wayne",
    "Bugs Bunny",
    "Bulma",
    "Buzz Lightyear",
    "C-3PO",
    "Captain America",
    "Captain Hook",
    "Captain Marvel",
    "Captain Price",
    "Captain Rex",
    "Carl Grimes",
    "Carl Johnson",
    "Carmen Sandiego",
    "Catwoman",
    "Chell",
    "Chewbacca",
    "Chun-Li",
    "Cinderella",
    "Ciri",
    "Clementine",
    "Clifford the Big Red Dog",
    "Cloud Strife",
    "Commander Cody",
    "Commander Shepard",
    "Corvo Attano",
    "Crash Bandicoot",
    "Cruella de Vil",
    "Daenerys Targaryen",
    "Daffy Duck",
    "Daphne Blake",
    "Daredevil",
    "Darth Maul",
    "Darth Sidious",
    "Darth Vader",
    "Daryl Dixon",
    "Davy Jones",
    "Deadpool",
    "Deathstroke",
    "Denji",
    "Dexter Morgan",
    "Dio Brando",
    "Doctor Doom",
    "Doctor Octopus",
    "Doctor Strange",
    "Donald Duck",
    "Donatello",
    "Donkey Kong",
    "Doom Slayer",
    "Dora the Explorer",
    "Dr Eggman",
    "Dr Emmett Brown",
    "Dr Watson",
    "Draco Malfoy",
    "Dracula",
    "Duke Nukem",
    "Edward Elric",
    "Eeyore",
    "Eleven",
    "Ellie Williams",
    "Elsa",
    "Eren Yeager",
    "Eric Cartman",
    "Ethan Hunt",
    "Ezio Auditore",
    "Faramir",
    "Faye Valentine",
    "Felix the Cat",
    "Finn the Human",
    "Fluttershy",
    "Forrest Gump",
    "Frank Castle",
    "Franklin Clinton",
    "Freddy Krueger",
    "Frieza",
    "Frodo Baggins",
    "Gandalf",
    "Ganondorf",
    "Garrus Vakarian",
    "Geralt of Rivia",
    "Ghostface",
    "GLaDOS",
    "Gohan",
    "Goku",
    "Gollum",
    "Goofy",
    "Gordon Freeman",
    "Griffith",
    "Grogu",
    "Groot",
    "Gru",
    "Guts",
    "Gwen Stacy",
    "Hades",
    "Hagrid",
    "Han Solo",
    "Hank Hill",
    "Hannibal Lecter",
    "Harley Quinn",
    "Harry Potter",
    "Harvey Dent",
    "Hatsune Miku",
    "He-Man",
    "Hello Kitty",
    "Hercule Poirot",
    "Hermione Granger",
    "Hiccup Haddock",
    "Hinata Hyuga",
    "Homelander",
    "Homer Simpson",
    "Hulk",
    "Ichigo Kurosaki",
    "Indiana Jones",
    "Inuyasha",
    "Iron Man",
    "Isabelle",
    "Jack Skellington",
    "Jack Sparrow",
    "Jade",
    "Jake the Dog",
    "James Bond",
    "Jason Voorhees",
    "Jean Grey",
    "Jean-Luc Picard",
    "Jesse Pinkman",
    "Jill Valentine",
    "Jimmy Neutron",
    "Jinx",
    "Joel Miller",
    "John Constantine",
    "John Marston",
    "John Wick",
    "Johnny Bravo",
    "Johnny Cage",
    "Johnny Silverhand",
    "Joker",
    "Jon Snow",
    "Joseph Joestar",
    "Jotaro Kujo",
    "Judy Hopps",
    "Kakashi Hatake",
    "Katniss Everdeen",
    "Ken Masters",
    "Kenny McCormick",
    "Kiki",
    "King Dedede",
    "King Kong",
    "Kirby",
    "Klaus Hargreeves",
    "Knuckles the Echidna",
    "Korra",
    "Kratos",
    "Kuromi",
    "Kuzco",
    "Kylo Ren",
    "Lara Croft",
    "Legolas",
    "Leia Organa",
    "Lelouch Lamperouge",
    "Leon Kennedy",
    "Lester Crest",
    "Levi Ackerman",
    "Lex Luthor",
    "Light Yagami",
    "Lightning McQueen",
    "Lilo Pelekai",
    "Link",
    "Lisa Simpson",
    "Little Mac",
    "Loki",
    "Lucario",
    "Lucifer Morningstar",
    "Luffy",
    "Luigi",
    "Luke Skywalker",
    "Luna Lovegood",
    "Mabel Pines",
    "Mad Hatter",
    "Magneto",
    "Mai Shiranui",
    "Majin Buu",
    "Makima",
    "Malenia",
    "Mandalorian",
    "Marge Simpson",
    "Mario",
    "Master Chief",
    "Master Roshi",
    "Meg Griffin",
    "Megamind",
    "Megatron",
    "Michael De Santa",
    "Mickey Mouse",
    "Mikasa Ackerman",
    "Miles Morales",
    "Minato Namikaze",
    "Minnie Mouse",
    "Mister Fantastic",
    "Monkey D Luffy",
    "Mordecai",
    "Morticia Addams",
    "Morty Smith",
    "Mr Bean",
    "Mr Burns",
    "Mr Krabs",
    "Ms Marvel",
    "Mufasa",
    "Mulan",
    "Nami",
    "Naruto Uzumaki",
    "Nathan Drake",
    "Ned Flanders",
    "Ned Stark",
    "Neo",
    "Nico Robin",
    "Niko Bellic",
    "Nobara Kugisaki",
    "Obi-Wan Kenobi",
    "Olaf",
    "Optimus Prime",
    "Orochimaru",
    "Paddington Bear",
    "Palpatine",
    "Papu Papu",
    "Patrick Star",
    "Pennywise",
    "Peppa Pig",
    "Percy Jackson",
    "Perry the Platypus",
    "Peter Griffin",
    "Peter Parker",
    "Peter Rabbit",
    "Phoenix Wright",
    "Pikachu",
    "Po",
    "Popeye",
    "Princess Bubblegum",
    "Princess Daisy",
    "Princess Mononoke",
    "Princess Peach",
    "Princess Zelda",
    "Professor Oak",
    "Professor X",
    "R2-D2",
    "Ragnar Lothbrok",
    "Rambo",
    "Rapunzel",
    "Rei Ayanami",
    "Rem",
    "Remy",
    "Rick Grimes",
    "Rick Sanchez",
    "Robin",
    "Rocky Balboa",
    "Ron Weasley",
    "Roronoa Zoro",
    "Rosalina",
    "Ryu",
    "Saitama",
    "Sakura Haruno",
    "Sam Fisher",
    "Samwise Gamgee",
    "Sarah Connor",
    "Sasuke Uchiha",
    "Saul Goodman",
    "Sauron",
    "Scarlet Witch",
    "Scooby-Doo",
    "Scorpion",
    "Sephiroth",
    "Severus Snape",
    "Shaggy Rogers",
    "Sherlock Holmes",
    "Shinji Ikari",
    "Shoto Todoroki",
    "Shrek",
    "Simba",
    "Sirius Black",
    "Skeletor",
    "Snow White",
    "Sokka",
    "Solid Snake",
    "Solidus Snake",
    "Son Gohan",
    "Son Goku",
    "Sonic the Hedgehog",
    "Sora",
    "Spawn",
    "Spider-Man",
    "SpongeBob SquarePants",
    "Squidward Tentacles",
    "Stan Marsh",
    "Star Butterfly",
    "Steve Minecraft",
    "Steve Rogers",
    "Steven Universe",
    "Stitch",
    "Stuart Little",
    "Sub-Zero",
    "Superman",
    "Sylvanas Windrunner",
    "Tails",
    "Tails Prower",
    "Tanjiro Kamado",
    "Tenzin",
    "Thanos",
    "The Flash",
    "The Mandalorian",
    "The Riddler",
    "Thomas Shelby",
    "Thor",
    "Thor Odinson",
    "Tifa Lockhart",
    "Tigger",
    "Timmy Turner",
    "Tom Nook",
    "Tommy Vercetti",
    "Tony Stark",
    "Toothless",
    "Trunks",
    "Tyrion Lannister",
    "Ultron",
    "Ursula",
    "Vegeta",
    "Velma Dinkley",
    "Venom",
    "Violet Parr",
    "Vision",
    "Vito Corleone",
    "Voldemort",
    "Walter White",
    "Waluigi",
    "Wario",
    "Wednesday Addams",
    "Winnie the Pooh",
    "Wolverine",
    "Wonder Woman",
    "Woody",
    "Wreck-It Ralph",
    "Yennefer of Vengerberg",
    "Yoda",
    "Yoshi",
    "Yuji Itadori",
    "Zatanna",
    "Zelda",
    "Zoro",
    "Zuko"
  ]
}
