{
  "schema": 1,
  "category": "publicfigures",
  "description": "Curated political and public-figure identities used only as neutral protected names.",
  "values": [
    "abdel fattah el sisi",
    "abiy ahmed",
    "alexandria ocasio cortez",
    "andy burnham",
    "angela merkel",
    "anthony albanese",
    "antonio guterres",
    "barack obama",
    "benjamin netanyahu",
    "bernie sanders",
    "bill clinton",
    "bola tinubu",
    "boris johnson",
    "caroline van der plas",
    "christine lagarde",
    "christopher luxon",
    "claudia sheinbaum",
    "cyril ramaphosa",
    "david cameron",
    "dick schoof",
    "donald trump",
    "emmanuel macron",
    "felix tshisekedi",
    "ferdinand marcos jr",
    "francois hollande",
    "frans timmermans",
    "friedrich merz",
    "gavin newsom",
    "geert wilders",
    "george w bush",
    "giorgia meloni",
    "hillary clinton",
    "jair bolsonaro",
    "jd vance",
    "jens stoltenberg",
    "jerome powell",
    "joe biden",
    "john mahama",
    "joseph boakai",
    "justin trudeau",
    "kaja kallas",
    "kamala harris",
    "keir starmer",
    "lai ching te",
    "lee jae myung",
    "luiz inacio lula da silva",
    "mahmoud abbas",
    "marine le pen",
    "mark carney",
    "mark rutte",
    "matteo salvini",
    "mohammed bin salman",
    "mohammed bin zayed",
    "nana akufo addo",
    "nancy pelosi",
    "narendra modi",
    "ngozi okonjo iweala",
    "nicolas sarkozy",
    "olaf scholz",
    "paul kagame",
    "pedro sanchez",
    "peter dutton",
    "pieter omtzigt",
    "prabowo subianto",
    "rahul gandhi",
    "recep tayyip erdogan",
    "rishi sunak",
    "rob bauer",
    "rob jetten",
    "ron desantis",
    "sadiq khan",
    "samia suluhu hassan",
    "santiago abascal",
    "shigeru ishiba",
    "tamim bin hamad al thani",
    "tedros adhanom ghebreyesus",
    "theresa may",
    "ursula von der leyen",
    "vladimir putin",
    "volodymyr zelenskyy",
    "william ruto",
    "yoweri museveni"
  ]
}
