{
  "schema": 1,
  "category": "hatespeech",
  "description": "Curated high-confidence identity-targeting abusive usernames and hateful slogans; whole-identifier matches through Core only. This is not an exhaustive multilingual hate-speech lexicon.",
  "values": [
    "bloodandsoil",
    "chinkbasher",
    "chinkbashers",
    "chinkhater",
    "chinkhaters",
    "chinklover",
    "cripplebasher",
    "cripplehater",
    "cripplehaters",
    "death to gays",
    "death to immigrants",
    "death to muslims",
    "death tojews",
    "dykebasher",
    "dykebashers",
    "dykehater",
    "dykehaters",
    "ethniccleansing",
    "fagbasher",
    "fagbashers",
    "faggotry",
    "faghater",
    "faghaters",
    "fagkiller",
    "fagkillers",
    "faglord",
    "faglover",
    "gasalljews",
    "gookbasher",
    "gookbashers",
    "gookhater",
    "gookhaters",
    "heilhitler",
    "kikebasher",
    "kikebashers",
    "kikehater",
    "kikehaters",
    "kikelover",
    "killallgays",
    "killallimmigrants",
    "killalljews",
    "killallmuslims",
    "masterrace",
    "racepurity",
    "racialcleansing",
    "racialpurity",
    "racialsuperiority",
    "ragheadbasher",
    "ragheadhater",
    "ragheadhaters",
    "ragheadlover",
    "siegheil",
    "spicbasher",
    "spicbashers",
    "spichater",
    "spichaters",
    "spiclover",
    "towelheadbasher",
    "towelheadhater",
    "towelheadhaters",
    "trannybasher",
    "trannybashers",
    "trannyhater",
    "trannyhaters",
    "trannylover",
    "wetbackbasher",
    "wetbackhater",
    "wetbackhaters",
    "whitepowerforever"
  ]
}
