{
  "schema": 1,
  "category": "financial",
  "description": "Banks, insurers, payment institutions, asset managers, and other financial-service identities from many countries and regions.",
  "values": [
    "abanca",
    "absa bank",
    "adyen bank",
    "aia group",
    "akbank",
    "allstate",
    "alpha bank",
    "american express bank",
    "anz bank",
    "argenta",
    "axa",
    "banca mediolanum",
    "banca monte dei paschi di siena",
    "banco bilbao vizcaya argentaria",
    "banco do brasil",
    "banco santander",
    "bank hapoalim",
    "bank leumi",
    "bank mandiri",
    "bank millennium",
    "bank muscat",
    "bank of china",
    "bank of ireland",
    "bank of montreal",
    "bank of new york mellon",
    "bank rakyat indonesia",
    "bankia",
    "banorte",
    "bawag",
    "belfius",
    "blackrock",
    "bmo",
    "bnp paribas fortis",
    "bradesco",
    "caixa economica federal",
    "canara bank",
    "capital one bank",
    "cathay united bank",
    "charles schwab",
    "china citic bank",
    "china construction bank",
    "china merchants bank",
    "citizens bank",
    "commonwealth bank",
    "credit suisse",
    "creditas",
    "dbs bank",
    "discover bank",
    "dnb",
    "dz bank",
    "erste bank",
    "eurobank",
    "fidelity investments",
    "fifth third bank",
    "first abu dhabi bank",
    "first citizens bank",
    "franklin templeton",
    "gazprombank",
    "generali",
    "hana bank",
    "hang seng bank",
    "icbc",
    "ing bank",
    "intesa sanpaolo",
    "invesco",
    "itau unibanco",
    "jp morgan asset management",
    "julius baer",
    "kbc bank",
    "keybank",
    "klarna bank",
    "kotak mahindra bank",
    "landesbank baden wurttemberg",
    "legal and general",
    "lloyds bank",
    "manulife",
    "metlife",
    "mizuho bank",
    "morgan stanley",
    "mufg bank",
    "munich re",
    "national australia bank",
    "national bank of canada",
    "nationwide building society",
    "natwest",
    "nordea bank",
    "northern trust",
    "ocbc bank",
    "otp bank",
    "paypal payments",
    "pimco",
    "pnc bank",
    "prudential financial",
    "raiffeisen bank",
    "revolut bank",
    "royal bank of canada",
    "royal bank of scotland",
    "schroders",
    "scotiabank",
    "seb bank",
    "shinhan bank",
    "societe generale",
    "standard bank",
    "standard chartered",
    "state bank of india",
    "state street",
    "stripe payments",
    "sumitomo mitsui banking corporation",
    "sun life",
    "swedbank",
    "swiss re",
    "t rowe price",
    "td bank",
    "travelers",
    "truist",
    "ubs bank",
    "unicredit bank",
    "uob",
    "us bank",
    "vanguard",
    "virgin money",
    "visa europe",
    "wells fargo bank",
    "westpac",
    "wise payments",
    "worldline",
    "yes bank",
    "zurich cantonal bank"
  ]
}
