{
  "schema": 1,
  "category": "fiction",
  "description": "Fictional character identities from literature, film, television, comics, animation, and games.",
  "values": [
    "ahsoka tano",
    "albus dumbledore",
    "anakin skywalker",
    "aragorn",
    "arthur dent",
    "ash ketchum",
    "asterix",
    "atreus",
    "bart simpson",
    "batman",
    "bilbo baggins",
    "black panther",
    "black widow",
    "bojack horseman",
    "bowser",
    "bruce banner",
    "bruce wayne",
    "bugs bunny",
    "captain america",
    "cersei lannister",
    "chandler bing",
    "charizard",
    "ciri",
    "clark kent",
    "cortana",
    "daenerys targaryen",
    "daffy duck",
    "darth vader",
    "daryl dixon",
    "deadpool",
    "dexter morgan",
    "diana prince",
    "din djarin",
    "doctor strange",
    "don draper",
    "donald duck",
    "doom slayer",
    "dwight schrute",
    "eleven hopper",
    "frodo baggins",
    "gandalf",
    "ganondorf",
    "geralt of rivia",
    "gimli",
    "gollum",
    "goofy",
    "grogu",
    "han solo",
    "hannibal lecter",
    "harry potter",
    "hermione granger",
    "homer simpson",
    "hulk",
    "indiana jones",
    "iron man",
    "james bond",
    "jesse pinkman",
    "joey tribbiani",
    "john rambo",
    "john watson",
    "jon snow",
    "kratos",
    "lara croft",
    "legolas",
    "leia organa",
    "link",
    "lisa simpson",
    "logan howlett",
    "loki laufeyson",
    "luigi",
    "luke skywalker",
    "magneto",
    "marge simpson",
    "mario",
    "master chief",
    "michael scott",
    "mickey mouse",
    "miles tails prower",
    "minnie mouse",
    "monica geller",
    "morty smith",
    "natasha romanoff",
    "nathan drake",
    "ned stark",
    "obi wan kenobi",
    "palpatine",
    "patrick star",
    "peter griffin",
    "peter parker",
    "phoebe buffay",
    "pikachu",
    "princess peach",
    "princess zelda",
    "professor x",
    "rachel green",
    "rick grimes",
    "rick sanchez",
    "rocky balboa",
    "ron weasley",
    "ross geller",
    "samus aran",
    "saul goodman",
    "sauron",
    "scooby doo",
    "severus snape",
    "shadow the hedgehog",
    "shaggy rogers",
    "sherlock holmes",
    "solid snake",
    "sonic the hedgehog",
    "spider man",
    "spongebob squarepants",
    "stephen strange",
    "steve rogers",
    "superman",
    "tchalla",
    "ted lasso",
    "thor odinson",
    "tony soprano",
    "tony stark",
    "triss merigold",
    "tyrion lannister",
    "voldemort",
    "wade wilson",
    "walter white",
    "wednesday addams",
    "wolverine",
    "wonder woman",
    "yennefer",
    "yoda"
  ]
}
