{
  "schema": 1,
  "category": "crypto",
  "description": "Cryptocurrency, blockchain and decentralized-finance project names.",
  "values": [
    "1inch",
    "Akash Network",
    "Algorand",
    "ApeCoin",
    "Aptos",
    "Arbitrum",
    "Arweave",
    "Astar",
    "Avalanche",
    "Axie Infinity",
    "Basic Attention Token",
    "Bitcoin",
    "Bitcoin Cash",
    "Bitget Token",
    "Bittensor",
    "Blur",
    "Cardano",
    "Celestia",
    "Celo",
    "Chiliz",
    "Compound",
    "Conflux",
    "Core DAO",
    "Cosmos",
    "Curve DAO",
    "Dash",
    "Decentraland",
    "Decred",
    "Dogecoin",
    "Enjin Coin",
    "EOS",
    "Ethereum",
    "Ethereum Classic",
    "Fantom",
    "Fetch.ai",
    "Filecoin",
    "Flow",
    "Gala",
    "GateToken",
    "Gnosis",
    "Harmony",
    "Hedera",
    "Helium",
    "Illuvium",
    "Immutable",
    "Injective",
    "Internet Computer",
    "IOTA",
    "Jupiter",
    "Kaia",
    "Kaspa",
    "Kava",
    "KuCoin Token",
    "Kusama",
    "Lido DAO",
    "Litecoin",
    "Loopring",
    "Maker",
    "Mantle",
    "Mina Protocol",
    "Monero",
    "Moonbeam",
    "Moonriver",
    "MultiversX",
    "Near Protocol",
    "Nexo",
    "Ocean Protocol",
    "OKB",
    "Ondo",
    "Ontology",
    "Optimism",
    "Ordinals",
    "Pendle",
    "Polkadot",
    "Pyth Network",
    "Quant",
    "Ravencoin",
    "Safe",
    "Shiba Inu",
    "SingularityNET",
    "Solana",
    "Stacks",
    "Stellar",
    "Tether",
    "Tezos",
    "The Graph",
    "The Sandbox",
    "Theta Network",
    "THORChain",
    "Toncoin",
    "VeChain",
    "Waves",
    "Worldcoin",
    "Zcash",
    "Zilliqa"
  ]
}
