{
  "schema": 1,
  "category": "profanity",
  "description": "Common English profanity and vulgar insults. This category is opt-in and intentionally excludes identity-targeting slurs.",
  "values": [
    "arse",
    "arsehole",
    "ass",
    "assclown",
    "assface",
    "asshat",
    "asshole",
    "asslicker",
    "asswipe",
    "bastard",
    "bitch",
    "bitchass",
    "bitches",
    "bitchface",
    "bitchy",
    "bollock",
    "bollocks",
    "bullshit",
    "bullshitter",
    "bullshitting",
    "bugger",
    "cock",
    "cockface",
    "cockhead",
    "cockmuncher",
    "cocksucker",
    "crap",
    "craphead",
    "crappy",
    "cunt",
    "cuntface",
    "dammit",
    "damn",
    "dick",
    "dickbag",
    "dickface",
    "dickhead",
    "dickwad",
    "dickweed",
    "dipshit",
    "douche",
    "douchebag",
    "dumbass",
    "fuck",
    "fuckass",
    "fucked",
    "fucker",
    "fuckers",
    "fuckface",
    "fuckhead",
    "fucking",
    "fuckoff",
    "fuckup",
    "fuckwad",
    "fuckwit",
    "goddamn",
    "goddammit",
    "horseshit",
    "jackass",
    "jackasses",
    "motherfucker",
    "motherfuckers",
    "motherfucking",
    "piss",
    "pissed",
    "pisser",
    "pissoff",
    "prick",
    "prickhead",
    "pussy",
    "shit",
    "shitass",
    "shitbag",
    "shitface",
    "shithead",
    "shitshow",
    "shitstorm",
    "shitty",
    "sonofabitch",
    "suckmyass",
    "suckmydick",
    "twat",
    "twatface",
    "wank",
    "wanker",
    "wankers",
    "wanking",
    "whore",
    "whorebag",
    "slut",
    "slutty",
    "skank",
    "skanky",
    "tosser",
    "bellend",
    "knobhead",
    "shitforbrains",
    "fucknugget",
    "fuckstick",
    "shitstain",
    "assmunch",
    "assmuncher",
    "buttfuck",
    "buttfucker",
    "clusterfuck",
    "dickless",
    "shitfuck",
    "shitwit",
    "wankstain"
  ]
}
