{
  "schema": 1,
  "category": "regionalprofanity",
  "description": "Additional regional slang, insults, and profanity across multiple languages.",
  "values": [
    "abruti",
    "amk",
    "anjing",
    "arschloch",
    "arsehole",
    "bangsat",
    "bastardo",
    "bellend",
    "berk",
    "bloody idiot",
    "bollocks",
    "bugger off",
    "buoi",
    "cabron",
    "capullo",
    "cazzo",
    "chav",
    "chuj",
    "coglione",
    "cojones",
    "con cac",
    "connard",
    "connasse",
    "couillon",
    "dickhead",
    "dit me",
    "du ma",
    "dummkopf",
    "dupek",
    "eikel",
    "encule",
    "figlio di puttana",
    "fotze",
    "fuckwit",
    "gerizekali",
    "gilipollas",
    "goblok",
    "hijoputa",
    "hoerenzoon",
    "hostia puta",
    "hufter",
    "hurensohn",
    "imbecil",
    "jebac",
    "kankerlijer",
    "klootzak",
    "knobhead",
    "kontol",
    "kurwa",
    "kutvent",
    "kutwijf",
    "lul",
    "mat day",
    "memek",
    "merdeux",
    "minger",
    "mistkerl",
    "mof",
    "mongool",
    "ngentot",
    "numpty",
    "orospu cocugu",
    "pendejo",
    "pezevenk",
    "pillock",
    "pizda",
    "plonker",
    "prat",
    "putain",
    "puto",
    "salaud",
    "salope",
    "scheisskerl",
    "schele",
    "schlampe",
    "shithead",
    "siktir",
    "skurwysyn",
    "slet",
    "stronzo",
    "sukkel",
    "teringlijer",
    "testa di cazzo",
    "tosser",
    "tyfuslijer",
    "vaffanculo",
    "vollidiot",
    "wanker",
    "wazzock",
    "wichser",
    "wijf"
  ]
}
