{
  "schema": 1,
  "category": "technology",
  "description": "Well-known technology companies, platforms, products, services, and ecosystems that are commonly impersonated.",
  "values": [
    "1password",
    "acer",
    "adobe",
    "akamai",
    "alienware",
    "amazon",
    "amd",
    "android",
    "angular",
    "ansible",
    "anthropic",
    "apple",
    "appleid",
    "appstore",
    "arduino",
    "argocd",
    "aspnet",
    "asus",
    "atlassian",
    "auth0",
    "aws",
    "azure",
    "azuredevops",
    "baidu",
    "bitbucket",
    "bitwarden",
    "blazor",
    "brave",
    "broadcom",
    "canva",
    "chatgpt",
    "chrome",
    "chromium",
    "circleci",
    "cisco",
    "claude",
    "cloudflare",
    "confluence",
    "copilot",
    "corsair",
    "crowdstrike",
    "csharp",
    "cursor",
    "databricks",
    "datadog",
    "debian",
    "deepseek",
    "dell",
    "digitalocean",
    "discord",
    "django",
    "docker",
    "dotnet",
    "dropbox",
    "drupal",
    "duckduckgo",
    "elasticsearch",
    "entityframework",
    "epicgames",
    "expressvpn",
    "facebook",
    "fastly",
    "fedora",
    "figma",
    "firebase",
    "firefox",
    "forgejo",
    "gcp",
    "gemini",
    "gitea",
    "github",
    "githubactions",
    "githubcopilot",
    "gitlab",
    "gitlabci",
    "gmail",
    "google",
    "googlecloud",
    "googleplay",
    "googleworkspace",
    "gradle",
    "grafana",
    "grok",
    "groq",
    "helm",
    "heroku",
    "hubspot",
    "huggingface",
    "ibm",
    "icloud",
    "insomnia",
    "instagram",
    "intel",
    "jenkins",
    "jetbrains",
    "jira",
    "joomla",
    "kafka",
    "kagi",
    "kubernetes",
    "laravel",
    "lastpass",
    "lenovo",
    "linkedin",
    "linode",
    "linux",
    "llama",
    "logitech",
    "lovable",
    "mailchimp",
    "mariadb",
    "maui",
    "maven",
    "messenger",
    "meta",
    "metaai",
    "microsoft",
    "microsoft365",
    "microsoftedge",
    "microsoftteams",
    "midjourney",
    "mistral",
    "mongodb",
    "mozilla",
    "mysql",
    "netlify",
    "newrelic",
    "nextjs",
    "nodejs",
    "nordvpn",
    "notion",
    "npm",
    "nuget",
    "nvidia",
    "office365",
    "okta",
    "ollama",
    "onedrive",
    "openai",
    "openrouter",
    "openshift",
    "opera",
    "oracle",
    "outlook",
    "palantir",
    "perplexity",
    "pinterest",
    "playstation",
    "pnpm",
    "podman",
    "postgresql",
    "postman",
    "prometheus",
    "proton",
    "protonmail",
    "protonvpn",
    "pulumi",
    "python",
    "qualcomm",
    "rabbitmq",
    "raspberrypi",
    "razer",
    "reactjs",
    "reddit",
    "redhat",
    "redis",
    "replit",
    "roblox",
    "salesforce",
    "samsung",
    "sap",
    "sendgrid",
    "sentry",
    "servicenow",
    "shopify",
    "signal",
    "skype",
    "slack",
    "snapchat",
    "snowflake",
    "sony",
    "soundcloud",
    "sourceforge",
    "splunk",
    "spotify",
    "springboot",
    "squarespace",
    "stabilityai",
    "steam",
    "supabase",
    "tailscale",
    "telegram",
    "terraform",
    "threads",
    "tiktok",
    "travisci",
    "trello",
    "tsmc",
    "twilio",
    "twitch",
    "twitter",
    "ubuntu",
    "unity",
    "unrealengine",
    "valve",
    "vercel",
    "visualstudio",
    "vmware",
    "vscode",
    "vuejs",
    "wechat",
    "whatsapp",
    "windows",
    "wireguard",
    "wix",
    "woocommerce",
    "wordpress",
    "xai",
    "xbox",
    "yahoo",
    "yandex",
    "yarn",
    "youtube",
    "zendesk",
    "zerotier",
    "zoom"
  ]
}
