{
  "schema": 1,
  "category": "cryptoprotocols",
  "description": "DeFi protocol identities. Opt in explicitly.",
  "values": [
    "0x Protocol",
    "1inch Network",
    "Aave Protocol",
    "Across Protocol",
    "API3",
    "Augur",
    "Axelar",
    "Balancer",
    "Bancor",
    "Band Protocol",
    "Centrifuge",
    "Chainlink",
    "Compound Protocol",
    "Convex Finance",
    "CoW Protocol",
    "Curve Finance",
    "dYdX",
    "EigenLayer",
    "Ethena",
    "Ether.fi",
    "Euler Finance",
    "Frax Finance",
    "GMX",
    "Gnosis Protocol",
    "Goldfinch",
    "Hyperliquid",
    "Jito",
    "Jupiter Exchange",
    "Kamino Finance",
    "Kelp DAO",
    "LayerZero",
    "Lido Finance",
    "Liquity",
    "MakerDAO",
    "Maple Finance",
    "Marinade Finance",
    "Morpho",
    "Notional Finance",
    "Ondo Finance",
    "Orca",
    "PancakeSwap",
    "Pendle Finance",
    "Perpetual Protocol",
    "Polymarket",
    "Puffer Finance",
    "Radiant Capital",
    "Raydium",
    "Renzo Protocol",
    "Rocket Pool",
    "Sky Protocol",
    "Spark Protocol",
    "Stargate Finance",
    "SushiSwap",
    "Synthetix",
    "TrueFi",
    "UMA Protocol",
    "Uniswap",
    "Uniswap Protocol",
    "Venus Protocol",
    "Wormhole",
    "Yearn Finance"
  ]
}
