{
  "schema": 1,
  "category": "celebrities",
  "description": "Expanded entertainment, sports, creator, television, and cultural celebrity identities.",
  "values": [
    "adele",
    "alicia keys",
    "andrea bocelli",
    "angelina jolie",
    "anne hathaway",
    "anthony hopkins",
    "ariana grande",
    "arnold schwarzenegger",
    "bad bunny",
    "bear grylls",
    "ben affleck",
    "benedict cumberbatch",
    "beyonce",
    "billie eilish",
    "brad pitt",
    "bradley cooper",
    "brie larson",
    "bruno mars",
    "cardi b",
    "carlos alcaraz",
    "cate blanchett",
    "celine dion",
    "charles leclerc",
    "charli damelio",
    "charli xcx",
    "charlize theron",
    "cher",
    "chris brown",
    "chris evans",
    "chris hemsworth",
    "chris pratt",
    "christian bale",
    "cillian murphy",
    "coco gauff",
    "colin farrell",
    "conan obrien",
    "conor mcgregor",
    "cristiano ronaldo",
    "daniel craig",
    "david attenborough",
    "denzel washington",
    "dua lipa",
    "dwayne johnson",
    "ed sheeran",
    "ellen degeneres",
    "elton john",
    "eminem",
    "emma stone",
    "emma watson",
    "erling haaland",
    "fernando alonso",
    "florence pugh",
    "george clooney",
    "giannis antetokounmpo",
    "gordon ramsay",
    "harrison ford",
    "harry kane",
    "harry styles",
    "helena bonham carter",
    "hugh jackman",
    "idris elba",
    "ishowspeed",
    "israel adesanya",
    "jack black",
    "jacksepticeye",
    "jake gyllenhaal",
    "jake paul",
    "jamie oliver",
    "jannik sinner",
    "jason momoa",
    "jennifer aniston",
    "jennifer lawrence",
    "jennifer lopez",
    "jimmy fallon",
    "jimmy kimmel",
    "joaquin phoenix",
    "johnny depp",
    "jon jones",
    "julia roberts",
    "justin bieber",
    "justin timberlake",
    "kai cenat",
    "karim benzema",
    "kate winslet",
    "katy perry",
    "keanu reeves",
    "kendall jenner",
    "kendrick lamar",
    "kevin de bruyne",
    "kevin durant",
    "kevin hart",
    "khaby lame",
    "kim kardashian",
    "kobe bryant",
    "kris jenner",
    "kylian mbappe",
    "kylie jenner",
    "lady gaga",
    "lana del rey",
    "lando norris",
    "lebron james",
    "leonardo dicaprio",
    "lewis hamilton",
    "lionel messi",
    "lizzo",
    "logan paul",
    "luka doncic",
    "luka modric",
    "lupita nyongo",
    "madonna",
    "marc marquez",
    "margot robbie",
    "mariah carey",
    "mark hamill",
    "mark ruffalo",
    "markiplier",
    "matt damon",
    "max verstappen",
    "meryl streep",
    "michael b jordan",
    "michael jordan",
    "miley cyrus",
    "mohamed salah",
    "morgan freeman",
    "mrbeast",
    "naomi osaka",
    "natalie portman",
    "neymar",
    "nicki minaj",
    "nicole kidman",
    "nikola jokic",
    "ninja blevins",
    "novak djokovic",
    "olivia rodrigo",
    "oprah winfrey",
    "paris hilton",
    "pedro pascal",
    "pewdiepie",
    "pokimane",
    "post malone",
    "rafael nadal",
    "reese witherspoon",
    "rihanna",
    "robert de niro",
    "robert downey jr",
    "robert lewandowski",
    "roger federer",
    "ronda rousey",
    "rory mcilroy",
    "ryan gosling",
    "ryan reynolds",
    "sabrina carpenter",
    "salma hayek",
    "sam smith",
    "samuel l jackson",
    "sandra bullock",
    "scarlett johansson",
    "scottie scheffler",
    "selena gomez",
    "serena williams",
    "shakira",
    "shaquille oneal",
    "sidney poitier",
    "simon cowell",
    "simone biles",
    "snoop dogg",
    "stephen colbert",
    "stephen curry",
    "the weeknd",
    "tiger woods",
    "tom cruise",
    "tom hanks",
    "travis scott",
    "trevor noah",
    "usain bolt",
    "usher",
    "valentino rossi",
    "venus williams",
    "viola davis",
    "virgil van dijk",
    "whitney houston",
    "will smith",
    "zendaya"
  ]
}
