{
  "schema": 1,
  "category": "brands",
  "description": "Well-known consumer, retail, automotive, financial, travel, logistics, media, and lifestyle brands that are commonly impersonated.",
  "values": [
    "7 eleven",
    "7eleven",
    "a and w",
    "abn amro",
    "abnamro",
    "activision",
    "adidas",
    "aeg",
    "aer lingus",
    "aeromexico",
    "afterpay",
    "air canada",
    "air france",
    "air india",
    "air new zealand",
    "airbnb",
    "aircanada",
    "airfrance",
    "airindia",
    "airnewzealand",
    "aldi",
    "alfa romeo",
    "alfaromeo",
    "alibaba",
    "aliexpress",
    "allianz",
    "allstate",
    "american airlines",
    "american express",
    "americanairlines",
    "americanexpress",
    "amex",
    "amtrak",
    "arby s",
    "arcteryx",
    "armani",
    "asics",
    "asos",
    "aston martin",
    "astonmartin",
    "audi",
    "axa",
    "b and q",
    "bacardi",
    "balenciaga",
    "bank of america",
    "bank of china",
    "bankofamerica",
    "bankofchina",
    "barclays",
    "bath and body works",
    "bayer",
    "beats",
    "ben and jerrys",
    "benetton",
    "bentley",
    "best buy",
    "bestbuy",
    "bet365",
    "bethesda",
    "bic",
    "binance",
    "birkenstock",
    "black and decker",
    "blizzard",
    "bmw",
    "bnp paribas",
    "bnpparibas",
    "body shop",
    "boeing",
    "bol com",
    "bolcom",
    "bolt",
    "booking",
    "bosch",
    "bose",
    "breitling",
    "bristol myers squibb",
    "british airways",
    "britishairways",
    "budweiser",
    "bugatti",
    "buick",
    "bulgari",
    "bunq",
    "burberry",
    "burger king",
    "burgerking",
    "bvlgari",
    "byd",
    "cadillac",
    "calvin klein",
    "calvinklein",
    "capcom",
    "capital one",
    "capitalone",
    "carlsberg",
    "carrefour",
    "cartier",
    "cash app",
    "cashapp",
    "caterpillar",
    "cathay pacific",
    "cathaypacific",
    "celsius",
    "chanel",
    "channel4",
    "chase",
    "chevrolet",
    "chevron",
    "chick fil a",
    "china airlines",
    "china southern",
    "chipotle",
    "citgo",
    "citi",
    "citibank",
    "citroen",
    "clarks",
    "coca cola",
    "coinbase",
    "colgate",
    "columbia",
    "comcast",
    "continental",
    "converse",
    "coop",
    "corona",
    "costco",
    "credit agricole",
    "credit suisse",
    "creditagricole",
    "creditsuisse",
    "crocs",
    "crunchyroll",
    "cryptocom",
    "cupra",
    "currys",
    "dacia",
    "dairy queen",
    "dairyqueen",
    "dannon",
    "danone",
    "danskebank",
    "dasani",
    "debenhams",
    "decathlon",
    "deezer",
    "deliveroo",
    "deloitte",
    "delsey",
    "delta",
    "delta airlines",
    "deutsche bank",
    "deutschebank",
    "dhl",
    "dhl express",
    "diesel",
    "dior",
    "discover",
    "discover card",
    "disney",
    "dodge",
    "dolce gabbana",
    "dolcegabbana",
    "dominos",
    "doordash",
    "doritos",
    "dpd",
    "dr pepper",
    "drmartens",
    "dsw",
    "dunkin",
    "dyson",
    "ea sports",
    "easports",
    "easyjet",
    "ebay",
    "eddie bauer",
    "electrolux",
    "emirates",
    "eon",
    "ernst and young",
    "etihad",
    "etsy",
    "eurostar",
    "evernote",
    "expedia",
    "exxonmobil",
    "fanta",
    "fedex",
    "fedex express",
    "fendi",
    "ferrari",
    "fiat",
    "fidelity",
    "fila",
    "foot locker",
    "footlocker",
    "ford",
    "forever 21",
    "fossil",
    "four seasons",
    "foursquare",
    "fujifilm",
    "garmin",
    "gatorade",
    "geico",
    "gillette",
    "giorgio armani",
    "givenchy",
    "gls",
    "gmc",
    "goodyear",
    "gopro",
    "gstar",
    "gucci",
    "guinness",
    "h and m",
    "haagen dazs",
    "harley davidson",
    "harleydavidson",
    "hbo",
    "heineken",
    "heinz",
    "hermes",
    "hersheys",
    "hilton",
    "hollister",
    "home depot",
    "homedepot",
    "honda",
    "honeywell",
    "hotelscom",
    "hsbc",
    "hublot",
    "hugo boss",
    "hugoboss",
    "hulu",
    "hyundai",
    "ibis",
    "icelandair",
    "ikea",
    "illy",
    "indeed",
    "ing",
    "intercontinental",
    "intuit",
    "isuzu",
    "j crew",
    "jack daniels",
    "jaguar",
    "jbl",
    "jeep",
    "john deere",
    "johnlewis",
    "johnson and johnson",
    "jollibee",
    "jpmorgan",
    "just eat",
    "justeat",
    "kawasaki",
    "kayak",
    "kelloggs",
    "kenzo",
    "kfc",
    "kia",
    "kikkoman",
    "kimberly clark",
    "kingspan",
    "kit kat",
    "kitkat",
    "klarna",
    "klm",
    "kohl s",
    "konami",
    "kone",
    "kpn",
    "kraft",
    "kraken",
    "lacoste",
    "lamborghini",
    "land rover",
    "landrover",
    "lays",
    "le coq sportif",
    "lee",
    "lego",
    "levis",
    "lexus",
    "lidl",
    "lipton",
    "lloyds bank",
    "lloydsbank",
    "loreal",
    "lotto",
    "louis vuitton",
    "lowes",
    "lucid",
    "lucid motors",
    "lufthansa",
    "lululemon",
    "lyft",
    "macys",
    "manchester united",
    "marks and spencer",
    "marriott",
    "mars",
    "marvel",
    "maserati",
    "mastercard",
    "maybelline",
    "mazda",
    "mcdonalds",
    "mclaren",
    "mediamarkt",
    "mercedes",
    "merrell",
    "merrill lynch",
    "metamask",
    "michelin",
    "miele",
    "mini",
    "mitsubishi",
    "moncler",
    "mondelez",
    "moneygram",
    "monster energy",
    "monsterenergy",
    "monzo",
    "morgan stanley",
    "morganstanley",
    "motorola",
    "msi",
    "n26",
    "national express",
    "nationwide",
    "natwest",
    "nescafe",
    "nespresso",
    "nestle",
    "netflix",
    "new balance",
    "new york times",
    "newbalance",
    "newyorktimes",
    "nh hotels",
    "nike",
    "nintendo",
    "nio",
    "nissan",
    "nivea",
    "nordea",
    "nordstrom",
    "norwegian",
    "novotel",
    "ocado",
    "old navy",
    "olympus",
    "omega",
    "onlyfans",
    "opel",
    "orange",
    "oreo",
    "p and g",
    "pampers",
    "panasonic",
    "pandora",
    "papa johns",
    "paramount",
    "patagonia",
    "payoneer",
    "paypal",
    "peacock",
    "peloton",
    "pepsi",
    "petco",
    "petsmart",
    "peugeot",
    "pfizer",
    "philips",
    "pirelli",
    "pixar",
    "pizza hut",
    "pizzahut",
    "planet fitness",
    "playmobil",
    "polaroid",
    "polestar",
    "popeyes",
    "porsche",
    "postnl",
    "poundland",
    "prada",
    "primark",
    "prime video",
    "primevideo",
    "procter and gamble",
    "progressive",
    "pull and bear",
    "puma",
    "qatar airways",
    "qatarairways",
    "rabobank",
    "ralph lauren",
    "ralphlauren",
    "ray ban",
    "rayban",
    "red bull",
    "reebok",
    "remitly",
    "renault",
    "revolut",
    "rewe",
    "ritz carlton",
    "rivian",
    "rockstar games",
    "rockstargames",
    "rolex",
    "rolls royce",
    "rollsroyce",
    "royal bank of canada",
    "royal caribbean",
    "royal mail",
    "royalmail",
    "ryanair",
    "sainsburys",
    "salomon",
    "santander",
    "scania",
    "schindler",
    "schweppes",
    "sears",
    "seat",
    "sega",
    "seiko",
    "sephora",
    "shein",
    "shell",
    "shoprite",
    "siemens",
    "skechers",
    "skoda",
    "skyscanner",
    "smartwater",
    "snickers",
    "sony pictures",
    "southwest airlines",
    "specsavers",
    "sprite",
    "star wars",
    "starbucks",
    "starwars",
    "state farm",
    "statefarm",
    "std bank",
    "stripe",
    "subaru",
    "subway",
    "sunwing",
    "superdry",
    "swatch",
    "swissair",
    "t mobile",
    "t rowe price",
    "taco bell",
    "tacobell",
    "tag heuer",
    "tagheuer",
    "tap air portugal",
    "target",
    "td bank",
    "temu",
    "tesco",
    "tesla",
    "the body shop",
    "the north face",
    "thenorthface",
    "thuisbezorgd",
    "ticketmaster",
    "tiffany",
    "tim hortons",
    "timberland",
    "tissot",
    "tj maxx",
    "tmobile",
    "tommy hilfiger",
    "tommyhilfiger",
    "topshop",
    "tory burch",
    "totalenergies",
    "toyota",
    "trader joes",
    "transavia",
    "tripadvisor",
    "trivago",
    "turkish airlines",
    "turkishairlines",
    "uber",
    "uber eats",
    "ubereats",
    "ubisoft",
    "ubs",
    "ulta",
    "under armour",
    "underarmour",
    "unilever",
    "uniqlo",
    "united airlines",
    "united parcel service",
    "unitedairlines",
    "universal pictures",
    "universalpictures",
    "ups",
    "urban outfitters",
    "usps",
    "valentino",
    "vans",
    "vauxhall",
    "veja",
    "venmo",
    "verizon",
    "versace",
    "virgin atlantic",
    "virgin media",
    "virginatlantic",
    "visa",
    "vodafone",
    "vodafone ziggo",
    "volkswagen",
    "volvo",
    "waitrose",
    "walmart",
    "warner bros",
    "warnerbros",
    "wawa",
    "we transfer",
    "wells fargo",
    "wellsfargo",
    "wendys",
    "western digital",
    "western union",
    "westernunion",
    "whirlpool",
    "whole foods",
    "wise",
    "wizz air",
    "wizzair",
    "wrangler",
    "xfinity",
    "yeti",
    "yonex",
    "zalando",
    "zara",
    "zelle",
    "ziggo"
  ]
}
