{
  "schema": 1,
  "category": "support",
  "description": "Names that could be mistaken for an official support, safety, billing, or trust channel.",
  "values": [
    "abuse help",
    "abuse report",
    "abuse support",
    "abusehelp",
    "abusereport",
    "abusesupport",
    "account assistance",
    "account help",
    "account recovery",
    "account support",
    "account verification",
    "accountassistance",
    "accounthelp",
    "accountrecovery",
    "accountsupport",
    "accountverification",
    "appeal",
    "appeal support",
    "appeals",
    "appeals team",
    "appealsteam",
    "appealsupport",
    "billing assistance",
    "billing department",
    "billing help",
    "billing support",
    "billing team",
    "billingassistance",
    "billingdepartment",
    "billinghelp",
    "billingsupport",
    "billingteam",
    "care team",
    "careteam",
    "chargeback support",
    "chargebacks",
    "chargebacksupport",
    "community help",
    "community support",
    "communityhelp",
    "communitysupport",
    "complaint",
    "complaints",
    "contact help",
    "contact support",
    "contact us",
    "contacthelp",
    "contactsupport",
    "contactus",
    "customer assistance",
    "customer care",
    "customer service",
    "customer success",
    "customer support",
    "customerassistance",
    "customercare",
    "customerservice",
    "customersuccess",
    "customersupport",
    "dispute resolution",
    "dispute support",
    "disputeresolution",
    "disputesupport",
    "fraud",
    "fraud alert",
    "fraud department",
    "fraud help",
    "fraud investigation",
    "fraud prevention",
    "fraud support",
    "fraudalert",
    "frauddepartment",
    "fraudhelp",
    "fraudinvestigation",
    "fraudprevention",
    "fraudsupport",
    "help",
    "help center",
    "help line",
    "help team",
    "helpcenter",
    "helpdesk",
    "helpline",
    "helpteam",
    "identity help",
    "identity support",
    "identity verification",
    "identityhelp",
    "identitysupport",
    "identityverification",
    "live help",
    "live support",
    "livehelp",
    "livesupport",
    "member support",
    "membersupport",
    "moderation team",
    "moderationteam",
    "official",
    "official help",
    "official support",
    "officialhelp",
    "officialsupport",
    "order help",
    "order support",
    "orderhelp",
    "ordersupport",
    "password help",
    "password reset",
    "passwordhelp",
    "passwordreset",
    "payment help",
    "payment support",
    "paymenthelp",
    "payments team",
    "paymentsteam",
    "paymentsupport",
    "privacy help",
    "privacy support",
    "privacy team",
    "privacyhelp",
    "privacysupport",
    "privacyteam",
    "recovery team",
    "recoveryteam",
    "refund",
    "refund help",
    "refund support",
    "refund team",
    "refundhelp",
    "refunds",
    "refundsupport",
    "refundteam",
    "report abuse",
    "report fraud",
    "report scam",
    "reportabuse",
    "reportfraud",
    "reportscam",
    "resolution center",
    "resolution team",
    "resolutioncenter",
    "resolutionteam",
    "safety center",
    "safety help",
    "safety support",
    "safety team",
    "safetycenter",
    "safetyhelp",
    "safetysupport",
    "safetyteam",
    "scam prevention",
    "scam support",
    "scamprevention",
    "scamsupport",
    "security",
    "security team",
    "securityteam",
    "service desk",
    "servicedesk",
    "support",
    "support center",
    "support department",
    "support line",
    "support service",
    "support team",
    "supportcenter",
    "supportdepartment",
    "supportline",
    "supportservice",
    "supportteam",
    "tech support",
    "technical support",
    "technicalsupport",
    "techsupport",
    "trust and safety",
    "trust center",
    "trust team",
    "trustandsafety",
    "trustcenter",
    "trustteam",
    "user support",
    "usersupport",
    "verification help",
    "verification support",
    "verification team",
    "verificationhelp",
    "verificationsupport",
    "verificationteam"
  ]
}
