{
  "schema": 1,
  "category": "multilingual",
  "description": "Additional multilingual reserved-role and official-account vocabulary.",
  "values": [
    "account ufficiale",
    "administrador",
    "administrador del sistema",
    "administrador do sistema",
    "administradora",
    "administrateur",
    "administratrice",
    "amministratore",
    "atendimento ao cliente",
    "autenticação",
    "autenticación",
    "autenticazione",
    "authenticatie",
    "authentification",
    "authentifizierung",
    "beheerder",
    "besitzer",
    "beveiliging",
    "compte officiel",
    "conta oficial",
    "cuenta oficial",
    "eigenaar",
    "fondateur",
    "fondatore",
    "fundador",
    "gründer",
    "helpcentrum",
    "hilfezentrum",
    "klantenservice",
    "kundendienst",
    "moderador",
    "moderadora",
    "modérateur",
    "moderatore",
    "moderatorin",
    "moderatrice",
    "officieel account",
    "offizielles konto",
    "oprichter",
    "propietario",
    "propriétaire",
    "proprietario",
    "proprietário",
    "sécurité",
    "segurança",
    "seguridad",
    "service client",
    "servicio al cliente",
    "servizio clienti",
    "sicherheit",
    "sicurezza",
    "systeembeheerder",
    "systemadministrator",
    "systemverwaltung",
    "veiligheid",
    "администратор",
    "безопасность",
    "модератор",
    "официальный",
    "поддержка",
    "помощь",
    "служба поддержки",
    "고객센터",
    "관리자",
    "운영자",
    "サポート",
    "セキュリティ",
    "ヘルプ",
    "モデレーター",
    "管理员",
    "管理員",
    "管理者"
  ]
}
