{
  "schema": 1,
  "category": "slangprofanity",
  "description": "Additional regional slang and profanity.",
  "values": [
    "abruti",
    "arschloch",
    "arsehole",
    "asshat",
    "asshats",
    "asshole",
    "asswipe",
    "babaca",
    "balordo",
    "bastard",
    "bellend",
    "bifolco",
    "buttheads",
    "cabrón",
    "caralho",
    "cocksucker",
    "coglione",
    "connard",
    "connasse",
    "coño",
    "culero",
    "dickhead",
    "dipshit",
    "dirtbags",
    "domkoppen",
    "douchebag",
    "douchebags",
    "drecksau",
    "dumbass",
    "dummschwätzer",
    "eikel",
    "enculé",
    "farabutto",
    "figlio di puttana",
    "filho da puta",
    "flachpfeife",
    "fotze",
    "fuckboi",
    "fuckboy",
    "fuckers",
    "fuckface",
    "fuckheads",
    "fuckwit",
    "gilipollas",
    "goujat",
    "hijo de puta",
    "hufters",
    "hurensohn",
    "jackass",
    "jackoffs",
    "jebany",
    "jerkoffs",
    "joder",
    "kackvogel",
    "klootzak",
    "klootzakken",
    "klunzen",
    "knobhead",
    "kutvent",
    "kutwijf",
    "lulhannes",
    "maleducado",
    "mamarracho",
    "mascalzone",
    "merdeux",
    "mistkerl",
    "motherfucker",
    "otário",
    "paspalho",
    "pendejo",
    "pignouf",
    "pillock",
    "porcalhão",
    "prick",
    "puta que pariu",
    "raclure",
    "salaud",
    "salopard",
    "salope",
    "scheißer",
    "scheißhaus",
    "scheißkerl",
    "schlemielen",
    "schurken",
    "scumbags",
    "shitbag",
    "shitbirds",
    "shitbrains",
    "shitface",
    "shithead",
    "shitshows",
    "skurwysyn",
    "slimeballs",
    "stronzo",
    "sukkel",
    "teringlijer",
    "testa di cazzo",
    "tocard",
    "tosser",
    "tossers",
    "twat",
    "twits",
    "tyfuslijer",
    "vaffanculo",
    "vollidiot",
    "volltrottel",
    "wanker",
    "wichser",
    "zakkenwasser",
    "zopenco"
  ]
}
